{
  "id": "F-0027",
  "tipo": "compreensao_local_nao_captada",
  "o_que_falta": "A compreensão local (W) de quem pratica, no período «final do século XIX», para os Elementos do grafo da cajuína (CL-0001) cujas Proposições não têm fala de quem pratica.",
  "por_que": "As Proposições desses Elementos vêm de autor, equipe de dossiê ou instituição; nenhuma fala de detentor, mestre ou comunidade as sustenta. O grafo mostra a W como paracompleta e não a completa por inferência (D-018).",
  "onde_aparece": [
    "EL-0016"
  ],
  "criada_por": "arquivista (EX-0071)",
  "data": "2026-10-29"
}
