{
  "id": "F-0026",
  "tipo": "outro",
  "o_que_falta": "Status botânico-cultural (nativo ou aculturado) de quatro insumos de apoio da cajuína: resina do cajueiro, cola de sapateiro, gelatina em pó e açúcar.",
  "por_que": "Nenhuma Proposição das extraídas diz se esses insumos são nativos ou aculturados; só se diz o que fazem no corte ou na bebida. Não se completa por inferência (D-018).",
  "onde_aparece": [
    "acervo/insumos-x (resina, cola, gelatina, açúcar)"
  ],
  "criada_por": "arquivista (EX-0071)",
  "data": "2026-10-29"
}
